{
  "$schema": "https://json-schema.org/draft/2020-12/schema",
  "$id": "https://craft-birdeye.github.io/birdeye-business-context/schemas/accounts-index.schema.json",
  "title": "accounts-index",
  "type": "object",
  "additionalProperties": false,
  "required": [
    "$schema",
    "schemaVersion",
    "generatedAt",
    "defaultAccountId",
    "order",
    "segments",
    "industries",
    "accounts"
  ],
  "properties": {
    "$schema": {
      "type": "string"
    },
    "schemaVersion": {
      "type": "string"
    },
    "generatedAt": {
      "type": "string",
      "format": "date-time",
      "pattern": "^\\d{4}-\\d{2}-\\d{2}T\\d{2}:\\d{2}:\\d{2}Z$"
    },
    "defaultAccountId": {
      "type": "string",
      "pattern": "^acct-[a-z0-9-]+$"
    },
    "order": {
      "type": "array",
      "minItems": 1,
      "items": {
        "type": "string",
        "pattern": "^acct-[a-z0-9-]+$"
      }
    },
    "segments": {
      "type": "array",
      "items": {
        "type": "object",
        "additionalProperties": false,
        "required": [
          "id",
          "label"
        ],
        "properties": {
          "id": {
            "enum": [
              "SMB",
              "ENT",
              "CH-SLV"
            ]
          },
          "label": {
            "type": "string",
            "minLength": 1
          }
        }
      }
    },
    "industries": {
      "type": "array",
      "items": {
        "type": "object",
        "additionalProperties": false,
        "required": [
          "id",
          "label"
        ],
        "properties": {
          "id": {
            "enum": [
              "dental-healthcare",
              "home-services",
              "automotive",
              "legal",
              "advertising-agency"
            ]
          },
          "label": {
            "type": "string",
            "minLength": 1
          }
        }
      }
    },
    "accounts": {
      "type": "object",
      "minProperties": 1,
      "propertyNames": {
        "type": "string",
        "pattern": "^acct-[a-z0-9-]+$"
      },
      "additionalProperties": {
        "type": "object",
        "additionalProperties": false,
        "required": [
          "id",
          "name",
          "brandName",
          "segment",
          "segmentLabel",
          "industryId",
          "industryLabel",
          "purchasedLocations",
          "hqLabel",
          "quickScenario",
          "branding",
          "counts",
          "bundleUrl"
        ],
        "properties": {
          "id": {
            "type": "string",
            "pattern": "^acct-[a-z0-9-]+$"
          },
          "name": {
            "type": "string",
            "minLength": 1
          },
          "brandName": {
            "type": "string",
            "minLength": 1
          },
          "segment": {
            "enum": [
              "SMB",
              "ENT",
              "CH-SLV"
            ]
          },
          "segmentLabel": {
            "type": "string",
            "minLength": 1
          },
          "industryId": {
            "enum": [
              "dental-healthcare",
              "home-services",
              "automotive",
              "legal",
              "advertising-agency"
            ]
          },
          "industryLabel": {
            "type": "string",
            "minLength": 1
          },
          "purchasedLocations": {
            "type": "integer",
            "minimum": 1
          },
          "hqLabel": {
            "type": "string",
            "minLength": 1
          },
          "quickScenario": {
            "type": "boolean"
          },
          "branding": {
            "type": "object",
            "additionalProperties": false,
            "required": [
              "brandName",
              "tagline",
              "logo",
              "colors"
            ],
            "properties": {
              "brandName": {
                "type": "string",
                "minLength": 1
              },
              "tagline": {
                "type": "string",
                "minLength": 1
              },
              "logo": {
                "type": "object",
                "additionalProperties": false,
                "required": [
                  "kind",
                  "initials",
                  "path",
                  "url"
                ],
                "properties": {
                  "kind": {
                    "enum": [
                      "monogram"
                    ]
                  },
                  "initials": {
                    "type": "string",
                    "pattern": "^[A-Z]{1,3}$"
                  },
                  "path": {
                    "type": "string",
                    "pattern": "^v1/logos/acct-[a-z0-9-]+\\.svg$"
                  },
                  "url": {
                    "type": "string",
                    "format": "uri"
                  }
                }
              },
              "colors": {
                "type": "object",
                "additionalProperties": false,
                "required": [
                  "primary",
                  "secondary",
                  "accent",
                  "onPrimary"
                ],
                "properties": {
                  "primary": {
                    "type": "string",
                    "pattern": "^#[0-9A-Fa-f]{6}$"
                  },
                  "secondary": {
                    "type": "string",
                    "pattern": "^#[0-9A-Fa-f]{6}$"
                  },
                  "accent": {
                    "type": "string",
                    "pattern": "^#[0-9A-Fa-f]{6}$"
                  },
                  "onPrimary": {
                    "type": "string",
                    "pattern": "^#[0-9A-Fa-f]{6}$"
                  }
                }
              }
            }
          },
          "counts": {
            "type": "object",
            "additionalProperties": false,
            "required": [
              "locations",
              "contacts",
              "reviews"
            ],
            "properties": {
              "locations": {
                "type": "integer"
              },
              "contacts": {
                "type": "integer"
              },
              "reviews": {
                "type": "integer"
              }
            }
          },
          "bundleUrl": {
            "type": "string",
            "format": "uri"
          }
        }
      }
    }
  }
}
