{
  "$schema": "https://craft-birdeye.github.io/birdeye-business-context/schemas/accounts-index.schema.json",
  "schemaVersion": "1.0.0",
  "generatedAt": "2026-10-21T00:00:00Z",
  "defaultAccountId": "acct-evercoast",
  "order": [
    "acct-evercoast",
    "acct-brisquen-dental",
    "acct-tovaline-ortho",
    "acct-saltwick-dental",
    "acct-thimbleleaf-dental",
    "acct-puddlewick-kids",
    "acct-brindlemoss-dental",
    "acct-dentavane-channel",
    "acct-hearthquell-home",
    "acct-pipewren-plumbing",
    "acct-quarrytide-electric",
    "acct-thatchwhim-outdoor",
    "acct-coilhaven-hvac",
    "acct-patchwhit-handyman",
    "acct-hollowbeck-pest",
    "acct-franquill-channel",
    "acct-varrowmere-law",
    "acct-firthgale-counsel",
    "acct-plainsby-litigation",
    "acct-pellwrin-tax",
    "acct-wickhallow-law",
    "acct-valdrift-immigration",
    "acct-gavelmoor-injury",
    "acct-counselvane-channel",
    "acct-northquell",
    "acct-skelvane-media",
    "acct-lumbrisk-reputation",
    "acct-inkfallow-creative",
    "acct-tallomere-partners",
    "acct-hopskein-digital",
    "acct-kindlewry-studio",
    "acct-tramvelle-field",
    "acct-torqvale-auto",
    "acct-crestovar-motors",
    "acct-treadmarsh-tire",
    "acct-amperlund-ev",
    "acct-cornerwick-garage",
    "acct-buffwren-detail",
    "acct-panelbrook-collision",
    "acct-lotquill-channel"
  ],
  "segments": [
    {
      "id": "SMB",
      "label": "SMB"
    },
    {
      "id": "ENT",
      "label": "Enterprise"
    },
    {
      "id": "CH-SLV",
      "label": "Channel"
    }
  ],
  "industries": [
    {
      "id": "dental-healthcare",
      "label": "Dental and healthcare"
    },
    {
      "id": "home-services",
      "label": "Home services and contractors"
    },
    {
      "id": "legal",
      "label": "Legal and professional services"
    },
    {
      "id": "advertising-agency",
      "label": "Advertising and agency"
    },
    {
      "id": "automotive",
      "label": "Automotive"
    }
  ],
  "accounts": {
    "acct-evercoast": {
      "id": "acct-evercoast",
      "name": "Evercoast Dental Partners",
      "brandName": "Evercoast Dental",
      "segment": "ENT",
      "segmentLabel": "Enterprise",
      "industryId": "dental-healthcare",
      "industryLabel": "Dental and healthcare",
      "purchasedLocations": 45,
      "hqLabel": "San Diego, CA",
      "quickScenario": true,
      "branding": {
        "brandName": "Evercoast Dental",
        "tagline": "Neighborhood dentistry from the Pacific to the Rockies",
        "logo": {
          "kind": "monogram",
          "initials": "ED",
          "path": "v1/logos/acct-evercoast.svg",
          "url": "https://craft-birdeye.github.io/birdeye-business-context/v1/logos/acct-evercoast.svg"
        },
        "colors": {
          "primary": "#0F6E8C",
          "secondary": "#E8F4F7",
          "accent": "#F2A541",
          "onPrimary": "#FFFFFF"
        }
      },
      "counts": {
        "locations": 45,
        "contacts": 10,
        "reviews": 14
      },
      "bundleUrl": "https://craft-birdeye.github.io/birdeye-business-context/v1/accounts/acct-evercoast.json"
    },
    "acct-brisquen-dental": {
      "id": "acct-brisquen-dental",
      "name": "Brisquen Dental Partners",
      "brandName": "Brisquen Dental",
      "segment": "ENT",
      "segmentLabel": "Enterprise",
      "industryId": "dental-healthcare",
      "industryLabel": "Dental and healthcare",
      "purchasedLocations": 5,
      "hqLabel": "Scottsdale, AZ",
      "quickScenario": false,
      "branding": {
        "brandName": "Brisquen Dental",
        "tagline": "Dentistry for the East Valley",
        "logo": {
          "kind": "monogram",
          "initials": "BD",
          "path": "v1/logos/acct-brisquen-dental.svg",
          "url": "https://craft-birdeye.github.io/birdeye-business-context/v1/logos/acct-brisquen-dental.svg"
        },
        "colors": {
          "primary": "#B5452B",
          "secondary": "#FBEDE7",
          "accent": "#2F5D62",
          "onPrimary": "#FFFFFF"
        }
      },
      "counts": {
        "locations": 5,
        "contacts": 8,
        "reviews": 8
      },
      "bundleUrl": "https://craft-birdeye.github.io/birdeye-business-context/v1/accounts/acct-brisquen-dental.json"
    },
    "acct-tovaline-ortho": {
      "id": "acct-tovaline-ortho",
      "name": "Tovaline Orthodontics Group",
      "brandName": "Tovaline Ortho",
      "segment": "ENT",
      "segmentLabel": "Enterprise",
      "industryId": "dental-healthcare",
      "industryLabel": "Dental and healthcare",
      "purchasedLocations": 8,
      "hqLabel": "Naperville, IL",
      "quickScenario": false,
      "branding": {
        "brandName": "Tovaline Ortho",
        "tagline": "Straight smiles, suburban schedules",
        "logo": {
          "kind": "monogram",
          "initials": "TO",
          "path": "v1/logos/acct-tovaline-ortho.svg",
          "url": "https://craft-birdeye.github.io/birdeye-business-context/v1/logos/acct-tovaline-ortho.svg"
        },
        "colors": {
          "primary": "#1F4E9C",
          "secondary": "#EAF1FB",
          "accent": "#3FB9A7",
          "onPrimary": "#FFFFFF"
        }
      },
      "counts": {
        "locations": 8,
        "contacts": 8,
        "reviews": 8
      },
      "bundleUrl": "https://craft-birdeye.github.io/birdeye-business-context/v1/accounts/acct-tovaline-ortho.json"
    },
    "acct-saltwick-dental": {
      "id": "acct-saltwick-dental",
      "name": "Saltwick Dental Collective",
      "brandName": "Saltwick Dental",
      "segment": "ENT",
      "segmentLabel": "Enterprise",
      "industryId": "dental-healthcare",
      "industryLabel": "Dental and healthcare",
      "purchasedLocations": 6,
      "hqLabel": "San Francisco, CA",
      "quickScenario": false,
      "branding": {
        "brandName": "Saltwick Dental",
        "tagline": "Bay Area dentistry that runs on time",
        "logo": {
          "kind": "monogram",
          "initials": "SD",
          "path": "v1/logos/acct-saltwick-dental.svg",
          "url": "https://craft-birdeye.github.io/birdeye-business-context/v1/logos/acct-saltwick-dental.svg"
        },
        "colors": {
          "primary": "#2E6F95",
          "secondary": "#EEF5F9",
          "accent": "#F28F79",
          "onPrimary": "#FFFFFF"
        }
      },
      "counts": {
        "locations": 6,
        "contacts": 8,
        "reviews": 8
      },
      "bundleUrl": "https://craft-birdeye.github.io/birdeye-business-context/v1/accounts/acct-saltwick-dental.json"
    },
    "acct-thimbleleaf-dental": {
      "id": "acct-thimbleleaf-dental",
      "name": "Thimbleleaf Family Dental",
      "brandName": "Thimbleleaf Family Dental",
      "segment": "SMB",
      "segmentLabel": "SMB",
      "industryId": "dental-healthcare",
      "industryLabel": "Dental and healthcare",
      "purchasedLocations": 1,
      "hqLabel": "Austin, TX",
      "quickScenario": true,
      "branding": {
        "brandName": "Thimbleleaf Family Dental",
        "tagline": "Family dentistry on South Lamar",
        "logo": {
          "kind": "monogram",
          "initials": "TF",
          "path": "v1/logos/acct-thimbleleaf-dental.svg",
          "url": "https://craft-birdeye.github.io/birdeye-business-context/v1/logos/acct-thimbleleaf-dental.svg"
        },
        "colors": {
          "primary": "#2F6B4F",
          "secondary": "#EFF6F1",
          "accent": "#C98B3B",
          "onPrimary": "#FFFFFF"
        }
      },
      "counts": {
        "locations": 1,
        "contacts": 10,
        "reviews": 10
      },
      "bundleUrl": "https://craft-birdeye.github.io/birdeye-business-context/v1/accounts/acct-thimbleleaf-dental.json"
    },
    "acct-puddlewick-kids": {
      "id": "acct-puddlewick-kids",
      "name": "Puddlewick Kids Dentistry",
      "brandName": "Puddlewick Kids Dentistry",
      "segment": "SMB",
      "segmentLabel": "SMB",
      "industryId": "dental-healthcare",
      "industryLabel": "Dental and healthcare",
      "purchasedLocations": 1,
      "hqLabel": "Portland, OR",
      "quickScenario": false,
      "branding": {
        "brandName": "Puddlewick Kids Dentistry",
        "tagline": "Happy visits for little teeth",
        "logo": {
          "kind": "monogram",
          "initials": "PK",
          "path": "v1/logos/acct-puddlewick-kids.svg",
          "url": "https://craft-birdeye.github.io/birdeye-business-context/v1/logos/acct-puddlewick-kids.svg"
        },
        "colors": {
          "primary": "#D9622B",
          "secondary": "#FFF3E8",
          "accent": "#4A9D5B",
          "onPrimary": "#FFFFFF"
        }
      },
      "counts": {
        "locations": 1,
        "contacts": 8,
        "reviews": 8
      },
      "bundleUrl": "https://craft-birdeye.github.io/birdeye-business-context/v1/accounts/acct-puddlewick-kids.json"
    },
    "acct-brindlemoss-dental": {
      "id": "acct-brindlemoss-dental",
      "name": "Brindlemoss Dental Studio",
      "brandName": "Brindlemoss Dental Studio",
      "segment": "SMB",
      "segmentLabel": "SMB",
      "industryId": "dental-healthcare",
      "industryLabel": "Dental and healthcare",
      "purchasedLocations": 1,
      "hqLabel": "Nashville, TN",
      "quickScenario": false,
      "branding": {
        "brandName": "Brindlemoss Dental Studio",
        "tagline": "Restorative and cosmetic dentistry in Nashville",
        "logo": {
          "kind": "monogram",
          "initials": "BD",
          "path": "v1/logos/acct-brindlemoss-dental.svg",
          "url": "https://craft-birdeye.github.io/birdeye-business-context/v1/logos/acct-brindlemoss-dental.svg"
        },
        "colors": {
          "primary": "#3B3A5C",
          "secondary": "#F3F2F8",
          "accent": "#C9A227",
          "onPrimary": "#FFFFFF"
        }
      },
      "counts": {
        "locations": 1,
        "contacts": 8,
        "reviews": 8